{
  "version": "2.0.0",
  "projectId": "ecommerce-platform",
  "projectInfo": {
    "name": "电商平台",
    "englishName": "E-commerce Platform",
    "description": "基于DDD设计的现代化电商平台，支持多商户、多商品、多支付方式的完整电商解决方案",
    "version": "1.0.0",
    "status": "IN_PROGRESS",
    "priority": "HIGH",
    "startDate": "2024-01-01",
    "endDate": "2024-12-31",
    "tags": ["电商", "DDD", "微服务", "云原生"]
  },
  "teamInfo": {
    "productOwner": {
      "name": "张三",
      "email": "zhangsan@company.com",
      "phone": "+86-138-0013-8000"
    },
    "technicalLead": {
      "name": "李四",
      "email": "lisi@company.com",
      "phone": "+86-139-0013-9000"
    },
    "teamMembers": [
      {
        "name": "王五",
        "email": "wangwu@company.com",
        "role": "ARCHITECT",
        "skills": ["DDD", "微服务架构", "Spring Boot", "Docker"]
      },
      {
        "name": "赵六",
        "email": "zhaoliu@company.com",
        "role": "DEVELOPER",
        "skills": ["Java", "Spring Boot", "MyBatis", "MySQL"]
      },
      {
        "name": "钱七",
        "email": "qianqi@company.com",
        "role": "DEVELOPER",
        "skills": ["React", "TypeScript", "Ant Design", "amis"]
      },
      {
        "name": "孙八",
        "email": "sunba@company.com",
        "role": "TESTER",
        "skills": ["自动化测试", "性能测试", "接口测试"]
      }
    ]
  },
  "technicalStack": {
    "frontend": {
      "framework": "REACT",
      "uiLibrary": "amis",
      "language": "TYPESCRIPT",
      "buildTool": "VITE"
    },
    "backend": {
      "framework": "SPRING_BOOT",
      "language": "JAVA",
      "database": "MYSQL",
      "orm": "MyBatis"
    },
    "infrastructure": {
      "deployment": "DOCKER",
      "cloud": "ALIYUN",
      "monitoring": ["PROMETHEUS", "GRAFANA", "ELASTICSEARCH"]
    }
  },
  "businessContext": {
    "industry": "E_COMMERCE",
    "businessType": "B2B2C",
    "targetUsers": ["个人消费者", "企业采购商", "平台商户", "系统管理员"],
    "businessGoals": [
      {
        "goal": "提供完整的电商交易流程，支持商品浏览、购物车、下单、支付、物流等核心功能",
        "priority": "CRITICAL",
        "metrics": ["交易成功率", "用户转化率", "订单处理时间"]
      },
      {
        "goal": "支持多商户入驻，提供商户管理、商品管理、订单管理等商户端功能",
        "priority": "HIGH",
        "metrics": ["商户入驻数量", "商户活跃度", "商户满意度"]
      },
      {
        "goal": "实现高性能、高可用的系统架构，支持大并发访问",
        "priority": "HIGH",
        "metrics": ["系统响应时间", "系统可用性", "并发处理能力"]
      }
    ]
  },
  "configuration": {
    "dddSettings": {
      "enableValidation": true,
      "strictMode": false,
      "autoDiscovery": true,
      "namingConvention": "CAMEL_CASE"
    },
    "codeGeneration": {
      "enableAutoGeneration": true,
      "targetLanguage": "JAVA",
      "framework": "Spring Boot",
      "outputPath": "./generated",
      "templateEngine": "VELOCITY"
    },
    "uiSettings": {
      "theme": "LIGHT",
      "language": "ZH_CN",
      "layout": "SIDEBAR"
    }
  },
  "statistics": {
    "lastUpdated": "2024-01-15T10:30:00Z",
    "elementCounts": {
      "businessTerms": 45,
      "boundedContexts": 8,
      "aggregates": 12,
      "entities": 25,
      "valueObjects": 18,
      "domainServices": 15,
      "dataTransferObjects": 32,
      "screenDefinitions": 20
    },
    "usageStatus": {
      "usedElements": 120,
      "unusedElements": 15,
      "orphanedReferences": 3
    },
    "completionRate": {
      "ubiquitousLanguage": 85,
      "strategicDesign": 90,
      "tacticalDesign": 75,
      "dataTransferObjects": 80,
      "implementationMapping": 60,
      "screenDefinition": 70,
      "overall": 77
    }
  },
  "metadata": {
    "createdAt": "2024-01-01T09:00:00Z",
    "createdBy": "zhangsan@company.com",
    "updatedAt": "2024-01-15T10:30:00Z",
    "updatedBy": "lisi@company.com",
    "version": "1.0.0",
    "checksum": "sha256:abc123def456..."
  }
}
